{
  "name": "cn",
  "type": "registry:lib",
  "dependencies": [
    "tailwind-merge",
    "clsx",
    "tailwind-variants"
  ],
  "files": [
    {
      "path": "src/registry/react/utils/cn.ts",
      "content": "import { type ClassValue, clsx } from \"clsx\";\nimport { twMerge } from \"tailwind-merge\";\n\nexport const cn = (...inputs: ClassValue[]) => twMerge(clsx(inputs));\n",
      "type": "registry:lib",
      "target": "utils/cn.ts"
    }
  ]
}